{
  "eventId": "39666666-6666-4666-8666-666666666666",
  "eventType": "evidence.revision-validation-state-changed",
  "schemaVersion": 1,
  "tenantId": "tenant-byd",
  "correlationId": "corr-m38-scan",
  "causationId": "11111111-1111-4111-8111-111111111199",
  "aggregateType": "EvidenceRevision",
  "aggregateId": "39222222-2222-4222-8222-222222222222",
  "aggregateVersion": 1,
  "occurredAt": "2026-07-14T09:01:00Z",
  "payload": {
    "evidenceRevisionId": "39222222-2222-4222-8222-222222222222",
    "evidenceItemId": "39333333-3333-4333-8333-333333333333",
    "evidenceSlotId": "39444444-4444-4444-8444-444444444444",
    "taskId": "88888888-8888-4888-8888-888888888888",
    "projectId": "33333333-3333-4333-8333-333333333333",
    "previousStatus": "STORED",
    "status": "VALIDATING",
    "fileLifecycleStatus": "AVAILABLE",
    "changedAt": "2026-07-14T09:01:00Z"
  }
}
